{
  "schema_version": 6,
  "id": "attack.the-final-encore",
  "name": "the final encore",
  "weapon_type": "BLUNT",
  "damage_type": "PHYSICAL",
  "min_damage": 44,
  "max_damage": 62,
  "hit_bonus": 13,
  "crit_bonus": 14,
  "damage_bonus": 18,
  "messages": [
    {
      "phase": "attack_hit",
      "channel": "self",
      "text": "You bring the final encore down on {target}, and the whole roar the Ovation could never spend crashes out of it at once, a hall's worth of refused applause landing in a single hammering demand. Your strike {verb} them!"
    },
    {
      "phase": "attack_hit",
      "channel": "target",
      "text": "{source} brings the final encore down on you and the blow arrives roaring, a wall of clapped demand crashing over you before it drives through. The strike {verb} you!"
    },
    {
      "phase": "attack_hit",
      "channel": "room",
      "text": "{source} brings the final encore down on {target}, and the crash of it rings through the air like a hall roaring for one more piece."
    },
    {
      "phase": "attack_miss",
      "channel": "self",
      "text": "You swing the final encore down at {target} and the roar sweeps past, a hall's demand crashing on through empty air with no measure to wring out of it."
    },
    {
      "phase": "attack_miss",
      "channel": "target",
      "text": "{source} swings the final encore down at you and the wall of applause passes by, dragging a wake of roaring demand where it should have struck."
    },
    {
      "phase": "attack_miss",
      "channel": "room",
      "text": "{source} swings the final encore down at {target} and the roaring blow finds only air, its crash thinning back into the dark unspent."
    },
    {
      "phase": "attack_crit",
      "channel": "self",
      "text": "You loose the whole final encore at once, and the roar the Ovation waited an eternity to spend crashes down on {target} entire, demanding one more measure of them and taking it! Your strike {verb} them!"
    },
    {
      "phase": "attack_crit",
      "channel": "target",
      "text": "{source} looses the final encore and the whole roar of a refused ending comes down on you at once, applause crashing over you from every side like a hall that will not let you stop! The strike {verb} you!"
    },
    {
      "phase": "attack_crit",
      "channel": "room",
      "text": "{source} looses the final encore into {target}, and the roar it releases hangs crashing in the air a moment too long, as if the whole hall were calling for one more piece."
    }
  ]
}
