{
  "schema_version": 6,
  "id": "attack.interval-unfallen-beat",
  "name": "an unlanded stroke",
  "min_damage": 72,
  "max_damage": 98,
  "hit_bonus": 10,
  "crit_bonus": 9,
  "damage_bonus": 19,
  "weapon_type": "BLUNT",
  "damage_type": "COLD",
  "applies_effect": {
    "effect_id": "freeze",
    "chance_percent": 75
  },
  "messages": [
    {
      "phase": "attack_hit",
      "channel": "self",
      "text": "The unfallen beat lets its held stroke drop toward you at last, all the tension of an eternity's delay released in a single downbeat of cold, and it lands on your pulse like a hammer that has been drawn back since the world began. The blow {verb} you!"
    },
    {
      "phase": "attack_miss",
      "channel": "self",
      "text": "The unfallen beat drives its long-delayed stroke down at the beat of you and the cold of the resolving count rushes in, and you throw yourself off the downbeat so the stroke lands on the stone where your heart had been."
    },
    {
      "phase": "attack_crit",
      "channel": "self",
      "text": "The unfallen beat lands its whole withheld eternity in one stroke, the entire arrested measure falling on you at once, and the cold of it drives so deep that your own heart stutters as if trying to match a beat too vast to keep! The blow {verb} you!"
    }
  ]
}
